{
  "schema_version": "1",
  "gate": "test",
  "story": "E5S2",
  "commit": "c7b39ca",
  "status": "pass",
  "exit_code": 0,
  "duration_ms": 47320,
  "metric": null,
  "summary": "test result: ok. 798 passed; 0 failed; 0 ignored; 0 measured; 0 filtered out; finished in 14.98s",
  "output_sha256": "c2d5b46748ff8cd839addfee0e9979fea0a77bacceda6732cd95365d0eac176f",
  "run_by": {
    "type": "human",
    "id": "simon"
  },
  "ran_at": "2026-10-02T07:19:53Z",
  "verifies": [],
  "skipped_locally": false
}
