{
  "schema_version": "1",
  "gate": "qdev-deps",
  "story": "E4S10",
  "commit": "b326405",
  "status": "pass",
  "exit_code": 0,
  "duration_ms": 185,
  "metric": null,
  "summary": "dependency check passed: zero undeclared imports or layer inversions",
  "output_sha256": "2021c1cc5321d367b3eb4f2badd2d15df7ac03e05864e4826ae183dc43a1f194",
  "run_by": {
    "type": "human",
    "id": "simon"
  },
  "ran_at": "2026-10-01T18:21:11Z",
  "verifies": [],
  "skipped_locally": false
}
