{
  "schema_version": "1",
  "gate": "check",
  "story": "E4S10",
  "commit": "b326405",
  "status": "pass",
  "exit_code": 0,
  "duration_ms": 970,
  "metric": null,
  "summary": "gate passed",
  "output_sha256": "077dcaca174fcb04f3192a4a18a2d2615982a989d421b1816c94552f1fde4513",
  "run_by": {
    "type": "human",
    "id": "simon"
  },
  "ran_at": "2026-10-01T18:21:12Z",
  "verifies": [],
  "skipped_locally": false
}
