{
  "schema_version": "1",
  "gate": "clippy",
  "story": "E5S3",
  "commit": "b0808ea",
  "status": "pass",
  "exit_code": 0,
  "duration_ms": 2191,
  "metric": null,
  "summary": "gate passed",
  "output_sha256": "7461db485bb8ec00716b139c166792b464de054b8a404044c0074b342a1bfe42",
  "run_by": {
    "type": "human",
    "id": "simon"
  },
  "ran_at": "2026-10-02T07:53:06Z",
  "verifies": [],
  "skipped_locally": false
}
