{
  "schema_version": "1",
  "gate": "qdev-scope",
  "story": "E5S5",
  "commit": "f137308",
  "status": "pass",
  "exit_code": 0,
  "duration_ms": 115,
  "metric": null,
  "summary": "scope check passed: all changed files within target_modules",
  "output_sha256": "f5ca50e228ca8e2e69f85550a9e5de8e9fea96905eca409d1ebf9c364aeec76c",
  "run_by": {
    "type": "human",
    "id": "simon"
  },
  "ran_at": "2026-10-03T05:36:57Z",
  "verifies": [],
  "skipped_locally": false
}
