{
  "schema_version": "1",
  "gate": "check",
  "story": "E5S1",
  "commit": "e998f49",
  "status": "pass",
  "exit_code": 0,
  "duration_ms": 2193,
  "metric": null,
  "summary": "gate passed",
  "output_sha256": "7b994aef0c6470c94836f660291951e43000a78011796c2cb1fd32e5f1b5e950",
  "run_by": {
    "type": "human",
    "id": "simon"
  },
  "ran_at": "2026-10-02T06:57:24Z",
  "verifies": [],
  "skipped_locally": false
}
