{
  "schema_version": "1",
  "gate": "test",
  "story": "E5S1",
  "commit": "e998f49",
  "status": "pass",
  "exit_code": 0,
  "duration_ms": 50519,
  "metric": null,
  "summary": "test result: ok. 798 passed; 0 failed; 0 ignored; 0 measured; 0 filtered out; finished in 14.78s",
  "output_sha256": "c0bc178272c44968fed4e91903f6bc15be04974493f214025257f77629777243",
  "run_by": {
    "type": "human",
    "id": "simon"
  },
  "ran_at": "2026-10-02T07:04:59Z",
  "verifies": [],
  "skipped_locally": false
}
