{
  "schema_version": "1",
  "gate": "clippy",
  "story": "E5S1",
  "commit": "e998f49",
  "status": "pass",
  "exit_code": 0,
  "duration_ms": 4544,
  "metric": null,
  "summary": "gate passed",
  "output_sha256": "c634cc9cc7ab736ac00e651b53c996c04246117c24f7d0b4461851cb0bc5fce8",
  "run_by": {
    "type": "human",
    "id": "simon"
  },
  "ran_at": "2026-10-02T06:58:11Z",
  "verifies": [],
  "skipped_locally": false
}
