{
  "schema_version": "1",
  "gate": "clippy",
  "story": "E5S5",
  "commit": "f137308",
  "status": "pass",
  "exit_code": 0,
  "duration_ms": 219,
  "metric": null,
  "summary": "gate passed",
  "output_sha256": "f0788aa36d1c86b6ccdfb7f4042a5574102d82061c046422a2d42e008a1e4710",
  "run_by": {
    "type": "human",
    "id": "simon"
  },
  "ran_at": "2026-10-03T05:35:19Z",
  "verifies": [],
  "skipped_locally": false
}
