{
  "schema_version": "1",
  "gate": "qdev-deps",
  "story": "E4S10",
  "commit": "b326405",
  "status": "fail",
  "exit_code": 1,
  "duration_ms": 195,
  "metric": null,
  "summary": "dependency check failed with 40 violation(s)",
  "output_sha256": "be2981b558a4ea3cea8539569775088743c5e033690da7d8d15bfaa445cf62c5",
  "run_by": {
    "type": "human",
    "id": "simon"
  },
  "ran_at": "2026-10-01T18:17:28Z",
  "verifies": [],
  "skipped_locally": false
}
