{
  "schema_version": "1",
  "gate": "clippy",
  "story": "E4S10",
  "commit": "b326405",
  "status": "pass",
  "exit_code": 0,
  "duration_ms": 1649,
  "metric": null,
  "summary": "gate passed",
  "output_sha256": "9f239b278cddcfcdfbcb1708692a1582ceaccac6db5ef762cfd76401405fe8c5",
  "run_by": {
    "type": "human",
    "id": "simon"
  },
  "ran_at": "2026-10-01T18:22:03Z",
  "verifies": [],
  "skipped_locally": false
}
