{
  "schema_version": "1",
  "gate": "check",
  "story": "E5S2",
  "commit": "c7b39ca",
  "status": "pass",
  "exit_code": 0,
  "duration_ms": 398,
  "metric": null,
  "summary": "gate passed",
  "output_sha256": "41a05261626df52d19dbb00921574f0e3075a388fc18e070af597d26495b0a72",
  "run_by": {
    "type": "human",
    "id": "simon"
  },
  "ran_at": "2026-10-02T07:19:06Z",
  "verifies": [],
  "skipped_locally": false
}
