{
  "schema_version": "1",
  "gate": "check",
  "story": "E5S4",
  "commit": "31d1300",
  "status": "pass",
  "exit_code": 0,
  "duration_ms": 1213,
  "metric": null,
  "summary": "gate passed",
  "output_sha256": "4d161cef345dc48cf345d3c9708a4576230e3d92a0f0fc07281b904490632709",
  "run_by": {
    "type": "human",
    "id": "simon"
  },
  "ran_at": "2026-10-02T10:58:18Z",
  "verifies": [],
  "skipped_locally": false
}
