{
  "schema_version": "1",
  "gate": "test",
  "story": "E4S10",
  "commit": "b326405",
  "status": "fail",
  "exit_code": 101,
  "duration_ms": 20490,
  "metric": null,
  "summary": "warning: unable to access '/Users/sim/.gitignore': Operation not permitted\nwarning: unable to access '/Users/sim/.gitignore': Operation not permitted\nwarning: unable to access '/Users/sim/.gitignore': Operation not permitted\nwarning: unable to access '/Users/sim/.gitignore': Operation not permitted\nwarning: unable to access '/Users/sim/.gitignore': Operation not permitted\nwarning: unable to access '/Users/sim/.gitignore': Operation not permitted\nwarning: unable to access '/Users/sim/.gitignore': Operation not permitted\nwarning: unable to access '/Users/sim/.gitignore': Operation not permitted\nTo /var/folders/sr/5g0r7pn51qldxb6fztmwg_qh0000gn/T/.tmpFXdWuh/origin.git\n * [new branch]      develop -> develop\nwarning: unable to access '/Users/sim/.gitignore': Operation not permitted\nTo /var/folders/sr/5g0r7pn51qldxb6fztmwg_qh0000gn/T/.tmpb2x66p/origin.git\n * [new branch]      develop -> develop\nwarning: unable to access '/Users/sim/.gitignore': Operation not permitted\nTo /var/folders/sr/5g0r7pn51qldxb6fztmwg_qh0000gn/T/.tmp4Roxuw/origin.git\n * [new branch]      develop -> develop\nwarning: unable to access '/Users/sim/.gitignore': Operation not permitted\nwarning: unable to access '/Users/sim/.gitignore': Operation not permitted\nSwitched to branch 'develop'\nwarning: unable to access '/Users/sim/.gitignore': Operation not permitted\nTo /var/folders/sr/5g0r7pn51qldxb6fztmwg_qh0000gn/T/.tmp1FBg86/origin.git\n * [new branch]      develop -> develop\nwarning: unable to access '/Users/sim/.gitignore': Operation not permitted\nTo /var/folders/sr/5g0r7pn51qldxb6fztmwg_qh0000gn/T/.tmpYmguIf/origin.git\n * [new branch]      develop -> develop\nTo /var/folders/sr/5g0r7pn51qldxb6fztmwg_qh0000gn/T/.tmpjJdWbM/origin.git\n * [new branch]      develop -> develop\nwarning: unable to access '/Users/sim/.gitignore': Operation not permitted\nTo /var/folders/sr/5g0r7pn51qldxb6fztmwg_qh0000gn/T/.tmp4Roxuw/origin.git\n   3f2d1d0..b468771  develop -> develop\nwarning: unable to access '/Users/sim/.gitignore': Operation not permitted\nwarning: unable to access '/Users/sim/.gitignore': Operation not permitted\nTo /var/folders/sr/5g0r7pn51qldxb6fztmwg_qh0000gn/T/.tmp4Roxuw/origin.git\n - [deleted]         develop\nwarning: unable to access '/Users/sim/.gitignore': Operation not permitted\nwarning: unable to access '/Users/sim/.gitignore': Operation not permitted\nSwitched to branch 'main'\nwarning: unable to access '/Users/sim/.gitignore': Operation not permitted\nwarning: unable to access '/Users/sim/.gitignore': Operation not permitted\nerror: test failed, to rerun pass `-p qdev-cli --test suite`",
  "output_sha256": "9a0eef10093e42886dfb36d0cbe03c0513de92a5285006954a259401c418f052",
  "run_by": {
    "type": "human",
    "id": "simon"
  },
  "ran_at": "2026-10-01T18:11:23Z",
  "verifies": [],
  "skipped_locally": false
}
