{
  "schema_version": "1",
  "gate": "check",
  "story": "E5S5",
  "commit": "f137308",
  "status": "pass",
  "exit_code": 0,
  "duration_ms": 86,
  "metric": null,
  "summary": "gate passed",
  "output_sha256": "ee1d3fffa2022e962e63e0dbe4d35c9c198450a20c29fc09030f635dbb38bfcd",
  "run_by": {
    "type": "human",
    "id": "simon"
  },
  "ran_at": "2026-10-03T05:36:57Z",
  "verifies": [],
  "skipped_locally": false
}
