{
  "schema_version": "1",
  "gate": "test",
  "story": "E4S10",
  "commit": "b326405",
  "status": "pass",
  "exit_code": 0,
  "duration_ms": 48959,
  "metric": null,
  "summary": "test result: ok. 798 passed; 0 failed; 0 ignored; 0 measured; 0 filtered out; finished in 14.83s",
  "output_sha256": "4c1bd987a497b444d0ca73cabdcb94d1edc7ce65ee45e14a57e912b7e1ab82ee",
  "run_by": {
    "type": "human",
    "id": "simon"
  },
  "ran_at": "2026-10-01T18:22:01Z",
  "verifies": [],
  "skipped_locally": false
}
